{"schemaVersion":1,"kind":"doctor","verdict":"UNKNOWN","exitCode":3,"dir":"/srv/example-site","checkedAt":"2026-09-21T12:00:00Z","checks":[{"checkId":"config.bindings","state":"pass","condition":"config.bindings-missing","detail":"EMAIL and AUTH_DB are declared"},{"checkId":"config.media-bucket","state":"skip","reason":"reason.not-run","condition":"config.media-bucket-missing","detail":"no media assets configured"},{"checkId":"config.observability","state":"fail","condition":"config.observability-off","detail":"observability.enabled is not true","fix":{"summary":"Set observability.enabled to true in wrangler.jsonc, then re-deploy.","url":"https://cairn.pub/docs/admin/is-it-working#turn-on-observability"}},{"checkId":"config.csrf-trusted-origins","state":"pass","condition":"config.csrf-trusted-origins-wildcard","detail":"no csrf.trustedOrigins entries in vite.config.ts, so SvelteKit's default origin check covers every route (heuristic text read)"},{"checkId":"config.site-config","state":"pass","condition":"config.site-config-invalid","detail":"parsed (per-concept URL policy lives on the adapter concepts, not checkable from the CLI)"},{"checkId":"config.public-origin","state":"pass","condition":"config.public-origin-invalid","detail":"PUBLIC_ORIGIN is https://example.com (wrangler vars)"},{"checkId":"config.no-referrer-blanket","state":"pass","condition":"config.no-referrer-blanket","detail":"no site-wide Referrer-Policy: no-referrer found (read src/hooks.server.ts; static/_headers not found, heuristic text read)"},{"checkId":"admin.mount-shape","state":"pass","condition":"admin.mount-incomplete","note":"no wired /admin mount detected; mount the shared /admin/+layout that renders CairnAdminShell and calls createCairnAdmin({ runtime }).shellLoad, and the /admin/[...path] catch-all rendering CairnAdmin"},{"checkId":"config.dependency-floors","state":"pass","condition":"config.dependency-floors-unmet","detail":"@sveltejs/kit 3.0.0 and svelte 5.56.10 satisfy the engine peer ranges"},{"checkId":"auth.role-wiring","state":"skip","reason":"reason.not-run","condition":"auth.role-wiring-missing","detail":"no custom roles declared; the guard fallback owner/editor already matches the vocabulary"},{"checkId":"ai.posture-effective","state":"unknown","reason":"reason.not-observable","condition":"ai.posture-not-effective","detail":"could not reach the resolved origin's /robots.txt"}]}
